{
  "schemaVersion": 2,
  "id": "hardened",
  "name": "Hardened",
  "order": 3,
  "tagline": "Maximum security, still anti-cheat compatible",
  "hint": "Balanced plus stronger security: ASR rules on Block, DNS over HTTPS and extra hardening. Still anti-cheat compatible.",
  "description": "Balanced plus encrypted DNS (Quad9), AI features off, Office/Adobe ASR rules in Block mode (instead of Audit), Controlled Folder Access in Audit mode, UAC always notify, NetBIOS off, Remote Desktop/Assistance off, PowerShell script block logging and the unused Wi-Fi adapter off. VBS, HVCI, TPM and Secure Boot stay exactly as competitive anti-cheat requires.",
  "gaming": true,
  "levelCeiling": "Advanced",
  "antiCheatPolicy": "safeOnly",
  "include": [
    "power.high-performance-plan",
    "power.usb-selective-suspend-off",
    "power.pcie-aspm-off",
    "power.fast-startup-off",
    "power.power-throttling-on",
    "gfx.game-mode",
    "gfx.background-recording-off",
    "gfx.windowed-optimizations",
    "gfx.vrr-optimizations",
    "input.pointer-precision-off",
    "input.accessibility-hotkeys-off",
    "net.eee-off",
    "net.rss-on",
    "net.tcp-autotuning-normal",
    "net.wifi-disable",
    "net.delivery-optimization-p2p-off",
    "net.doh-quad9",
    "privacy.diagnostic-data-required",
    "privacy.ads-suggestions-off",
    "privacy.widgets-off",
    "privacy.edge-background-off",
    "privacy.update-active-hours",
    "privacy.keep-drivers",
    "privacy.ai-features-off",
    "sec.hvci-on",
    "sec.vulnerable-driver-blocklist",
    "sec.lsa-protection",
    "sec.defender-hardening",
    "sec.network-protection",
    "sec.gaming-friendly-scans",
    "sec.asr-baseline",
    "sec.asr-office-block",
    "sec.cfa-audit",
    "sec.uac-on",
    "sec.uac-always-notify",
    "sec.llmnr-off",
    "sec.netbios-off",
    "sec.remote-access-off",
    "sec.autorun-off",
    "sec.smb-hardening",
    "sec.firewall-on",
    "sec.smartscreen-on",
    "sec.ps-scriptblock-logging"
  ],
  "exclude": []
}
